{
    "$schema": "http://json-schema.org/draft-07/schema",
    "title": "List of positions",
    "description": "Details of each position",
    "type": "array",
    "items": {
        "type": "object",
        "title": "Position",
        "required": [
            "name",
            "subteam",
            "division",
            "code",
            "description",
            "desirable",
            "required",
            "form"
        ],
        "additionalProperties": false,
        "properties": {
            "name": {
                "type": "string"
            },
            "subteam": {
                "type": "string"
            },
            "division": {
                "type": "string"
            },
            "code": {
                "type": "string"
            },
            "description": {
                "oneOf": [
                    {
                        "type": "string",
                        "title": "Single paragraph"
                    },
                    {
                        "title": "Multiple paragraphs",
                        "type": "array",
                        "minItems": 1,
                        "items": {
                            "oneOf": [
                                {
                                    "title": "Paragraph",
                                    "type": "string"
                                },
                                {
                                    "title": "Bulletted list",
                                    "type": "array",
                                    "minItems": 1,
                                    "items": {
                                        "title": "Item",
                                        "type": "string"
                                    }
                                }
                            ]
                        }
                    }
                ]
            },
            "desirable": {
                "title": "Desirable skills/knowledge",
                "type": "array",
                "minLength": 1,
                "items": {
                    "type": "string"
                }
            },
            "required": {
                "title": "Required skills/knowledge",
                "oneOf": [
                    {
                        "title": "Nothing",
                        "type": "null"
                    },
                    {
                        "title": "List",
                        "type": "array",
                        "minLength": 1,
                        "items": {
                            "type": "string"
                        }
                    }
                ]
            },
            "form": {
                "type": "string",
                "title": "Form link",
                "description": "Url piece after 'https://forms.gle/', e.g. YkbJ4NzrXGN8r1xc9"
            }
        }
    }
}